<!ELEMENT employees (employee*)>
<!ELEMENT employee (employee_id, first_name, last_name, salary)>
<!ELEMENT employee_id (#PCDATA)>
<!ELEMENT first_name (#PCDATA)>
<!ELEMENT last_name (#PCDATA)>
<!ELEMENT salary (#PCDATA)>
